{
  "$schema": "https://json-schema.org/draft/2020-12/schema",
  "type": "object",
  "properties": {
    "id": {
      "type": "string"
    },
    "version": {
      "type": "integer",
      "exclusiveMinimum": 0,
      "maximum": 9007199254740991
    },
    "contentApproval": {
      "type": "string",
      "const": "pending"
    },
    "enabled": {
      "type": "boolean",
      "const": false
    },
    "synthetic": {
      "type": "boolean",
      "const": true
    },
    "roleId": {
      "type": "string"
    },
    "required": {
      "type": "array",
      "items": {
        "type": "object",
        "properties": {
          "target": {
            "type": "object",
            "properties": {
              "fieldId": {
                "type": "string",
                "enum": [
                  "A01",
                  "A02",
                  "A03",
                  "A04",
                  "A05",
                  "A06",
                  "A07",
                  "A08",
                  "B01",
                  "B02",
                  "B03",
                  "B04",
                  "B05",
                  "B06",
                  "B07",
                  "C01",
                  "C02",
                  "C03",
                  "C04",
                  "C05",
                  "C06",
                  "C07",
                  "C08",
                  "D01",
                  "D02",
                  "D03",
                  "D04",
                  "D05",
                  "E01",
                  "E02",
                  "E03",
                  "E04",
                  "E05",
                  "E06",
                  "E07",
                  "E08",
                  "E09",
                  "F01",
                  "F02",
                  "F03",
                  "F04",
                  "F05",
                  "F06",
                  "F07",
                  "G01",
                  "G02",
                  "G03",
                  "G04",
                  "G05",
                  "H01",
                  "H02",
                  "H03",
                  "H04",
                  "H05",
                  "H06",
                  "H07",
                  "H08",
                  "H09",
                  "H10",
                  "I01",
                  "I02",
                  "I03",
                  "I04",
                  "I05",
                  "I06",
                  "J01",
                  "J02",
                  "J03",
                  "J04",
                  "J05",
                  "K01",
                  "K02",
                  "K03",
                  "K04",
                  "K05",
                  "K06",
                  "K07",
                  "L01",
                  "L02",
                  "L03",
                  "L04",
                  "L05",
                  "L06",
                  "L07",
                  "M01",
                  "M02",
                  "M03",
                  "M04",
                  "M05",
                  "M06",
                  "M07",
                  "M08",
                  "M09",
                  "M10",
                  "N01",
                  "N02",
                  "N03",
                  "N04",
                  "N05",
                  "N06",
                  "O01",
                  "O02",
                  "O03",
                  "O04",
                  "O05",
                  "O06",
                  "O07",
                  "O08",
                  "O09",
                  "P01",
                  "P02",
                  "P03",
                  "P04",
                  "P05",
                  "P06",
                  "P07",
                  "P08"
                ]
              },
              "recordId": {
                "type": "string"
              }
            },
            "required": [
              "fieldId"
            ],
            "additionalProperties": false
          },
          "allowedValues": {
            "type": "array",
            "items": {
              "anyOf": [
                {
                  "type": "string"
                },
                {
                  "type": "number"
                },
                {
                  "type": "boolean"
                },
                {
                  "type": "array",
                  "items": {
                    "type": "string"
                  }
                },
                {
                  "type": "null"
                }
              ]
            }
          }
        },
        "required": [
          "target",
          "allowedValues"
        ],
        "additionalProperties": false
      }
    },
    "requiredContext": {
      "type": "array",
      "items": {
        "type": "string"
      }
    },
    "allowedUnknown": {
      "type": "array",
      "items": {
        "type": "object",
        "properties": {
          "fieldId": {
            "type": "string",
            "enum": [
              "A01",
              "A02",
              "A03",
              "A04",
              "A05",
              "A06",
              "A07",
              "A08",
              "B01",
              "B02",
              "B03",
              "B04",
              "B05",
              "B06",
              "B07",
              "C01",
              "C02",
              "C03",
              "C04",
              "C05",
              "C06",
              "C07",
              "C08",
              "D01",
              "D02",
              "D03",
              "D04",
              "D05",
              "E01",
              "E02",
              "E03",
              "E04",
              "E05",
              "E06",
              "E07",
              "E08",
              "E09",
              "F01",
              "F02",
              "F03",
              "F04",
              "F05",
              "F06",
              "F07",
              "G01",
              "G02",
              "G03",
              "G04",
              "G05",
              "H01",
              "H02",
              "H03",
              "H04",
              "H05",
              "H06",
              "H07",
              "H08",
              "H09",
              "H10",
              "I01",
              "I02",
              "I03",
              "I04",
              "I05",
              "I06",
              "J01",
              "J02",
              "J03",
              "J04",
              "J05",
              "K01",
              "K02",
              "K03",
              "K04",
              "K05",
              "K06",
              "K07",
              "L01",
              "L02",
              "L03",
              "L04",
              "L05",
              "L06",
              "L07",
              "M01",
              "M02",
              "M03",
              "M04",
              "M05",
              "M06",
              "M07",
              "M08",
              "M09",
              "M10",
              "N01",
              "N02",
              "N03",
              "N04",
              "N05",
              "N06",
              "O01",
              "O02",
              "O03",
              "O04",
              "O05",
              "O06",
              "O07",
              "O08",
              "O09",
              "P01",
              "P02",
              "P03",
              "P04",
              "P05",
              "P06",
              "P07",
              "P08"
            ]
          },
          "recordId": {
            "type": "string"
          }
        },
        "required": [
          "fieldId"
        ],
        "additionalProperties": false
      }
    },
    "step": {
      "type": "string"
    },
    "limits": {
      "type": "array",
      "items": {
        "type": "string"
      }
    },
    "onMismatch": {
      "type": "string"
    },
    "humanEscalation": {
      "type": "string"
    }
  },
  "required": [
    "id",
    "version",
    "contentApproval",
    "enabled",
    "synthetic",
    "roleId",
    "required",
    "requiredContext",
    "allowedUnknown",
    "step",
    "limits",
    "onMismatch",
    "humanEscalation"
  ],
  "additionalProperties": false
}
